{
  "contract": "quiltor.story-world",
  "version": 1,
  "revision": 4,
  "payload": {
    "nodes": [
      {
        "id": "mara",
        "name": "Mara Venn",
        "type": "person",
        "label": "Protagonistin",
        "sub": "Kartographin",
        "accent": "ink",
        "x": 120,
        "y": 120,
        "mapX": 12,
        "mapY": 18,
        "dash": false,
        "pinned": true,
        "aliases": [{ "alias": "Die Kartographin", "source": "manual" }],
        "important": true,
        "diedMomentId": "arrival",
        "profile": {
          "notes": "Kennt das Archiv.",
          "noteReferences": [
            {
              "id": "profile-reference-archive",
              "target": { "kind": "place", "id": "archive" },
              "from": 10,
              "to": 16,
              "surface": "Archiv"
            }
          ],
          "noteMarks": [{ "from": 10, "to": 16, "kind": "bold" }],
          "fields": [
            { "id": "profile-field-age", "key": "Alter", "value": "32" },
            {
              "id": "profile-field-role",
              "key": "Rolle in der Geschichte",
              "value": "Kartographin"
            },
            { "id": "profile-field-look", "key": "Aussehen", "value": "Reisemantel" },
            {
              "id": "profile-field-origin",
              "key": "Herkunft & Vorgeschichte",
              "value": "Nordküste"
            },
            {
              "id": "profile-field-voice",
              "key": "Stimme & Sprechweise",
              "value": "ruhig"
            },
            { "id": "profile-field-motive", "key": "Motiv", "value": "Wahrheit" }
          ]
        }
      },
      {
        "id": "archive",
        "name": "Gezeitenarchiv",
        "type": "ort",
        "x": 480,
        "y": 260,
        "mapX": 35,
        "mapY": 45
      }
    ],
    "edges": [
      {
        "id": "searches",
        "from": "mara",
        "to": "archive",
        "label": "sucht",
        "style": "solid",
        "lineStyle": "dotted",
        "relationshipKind": "kinship",
        "color": "rose",
        "directed": true,
        "fromHandle": "right",
        "toHandle": "left",
        "active": true,
        "versions": [
          {
            "momentId": "arrival",
            "from": "mara",
            "to": "archive",
            "active": true,
            "label": "findet",
            "style": "gold",
            "lineStyle": "dashed",
            "relationshipKind": "general",
            "color": "blue",
            "directed": false
          }
        ]
      }
    ],
    "timeline": [
      {
        "id": "arrival",
        "title": "Ankunft",
        "time": -3,
        "position": 0,
        "precision": "day",
        "endTime": -2,
        "endPrecision": "day",
        "date": "1847-09-03",
        "note": "Der erste Archivbesuch.",
        "noteReferences": [
          {
            "id": "moment-reference-archive",
            "target": { "kind": "place", "id": "archive" },
            "from": 10,
            "to": 16,
            "surface": "Archiv"
          }
        ],
        "noteMarks": [{ "from": 0, "to": 23, "kind": "heading", "level": 3 }]
      }
    ],
    "presence": [
      {
        "id": "mara-at-archive",
        "elementId": "mara",
        "placeId": "archive",
        "momentId": "arrival"
      }
    ],
    "canvasSize": { "w": 960, "h": 720 },
    "mapScale": { "unitsPer100px": 2.5, "unitLabel": "km" },
    "timeSystem": {
      "id": "gregorian",
      "name": "Gregorianisch",
      "kind": "gregorian",
      "unit": "day",
      "eraName": "",
      "eraAbbreviation": "",
      "epochTime": 0,
      "epochYear": 1847,
      "epochMonth": 9,
      "epochDay": 3,
      "epochWeekday": 0,
      "displayFormat": "",
      "months": [{ "name": "Januar", "shortName": "Jan", "dayCount": 31 }],
      "weekdays": [{ "name": "Montag", "shortName": "Mo" }]
    },
    "extension": { "source": "contract-fixture" }
  }
}
